,Palabra,Cita,Titular,Diario,Fecha
204,lucha,0,La lucha por el voto de Ciudadanos: en estos 13 distritos y 10 municipios se juega el destino de Madrid,El Español,2021-04-30
209,comunistas,0,Falsedades y medias verdades en campaña | De las mentiras del voto por correo de Vox al bulo sobre las dictaduras comunistas,El País,2021-04-30
202,dictaduras,0,Falsedades y medias verdades en campaña | De las mentiras del voto por correo de Vox al bulo sobre las dictaduras comunistas,El País,2021-04-30
203,franquismo,0,Iglesias equipara la libertad que pide Ayuso con la época del franquismo,La Razón,2021-04-30
198,franquista,0,Elecciones Madrid | Ábalos compara el Madrid de Ayuso con el régimen franquista,El Confidencial,2021-04-30
199,balas,0,De balas y cañas,El País,2021-04-30
207,fascismo,0,Hanna Arendt y la normalización del fascismo,Público,2021-04-30
201,arremete,0,"Ábalos arremete contra Ayuso por sus ""ocurrencias alocadas"" y por mantener ""una relación impúdica con la ultraderecha""",El Mundo,2021-04-30
200,balas,1,"Monedero: ""Frente a sus balas, nuestros votos. Si ganamos es porque Iglesias bajó a Madrid""",El Español,2021-04-30
212,matones,1,Isabel Díaz Ayuso carga contra Iglesias por contratar “matones” para agredir a policías,La Razón,2021-05-01
213,matones,1,"Casado arremete contra Iglesias: ""No sólo le pagamos la niñera, sino a matones que patean a la Policía""",El Mundo,2021-05-01
215,violencia,0,"La ofensiva de Iglesias contra Vox, de justificar la violencia al escolta detenido",ABC,2021-05-01
216,arremete,0,"Casado arremete contra Iglesias: ""No sólo le pagamos la niñera, sino a matones que patean a la Policía""",El Mundo,2021-05-01
217,matones,1,Casado exige a Sánchez una condena «contra los matones de Iglesias que patearon a la Policía»,ABC,2021-05-01
218,ataques,0,Interior ocultó en plena campaña que dos 'escoltas' de Podemos lideraron los ataques a Vox en Vallecas y fueron detenidos,El Mundo,2021-05-01
219,fascismo,0,Ese fascismo del que usted me habla,eldiario.es,2021-05-01
214,lucha,0,La izquierda agarra la bandera de la lucha obrera para tumbar a la derecha en Madrid,Público,2021-05-01
226,violento,1,"Iglesias cierra la campaña acusando al PP de Ayuso de ""enemigo arrogante y violento de la democracia""",El Español,2021-05-02
229,fascismo,0,Podemos cierra la campaña más tensa con una defensa de la democracia frente al fascismo,El País,2021-05-02
228,violencia,0,Vox cierra una campaña acosado por la violencia y convencido de que será la clave de Madrid,El Mundo,2021-05-02
227,fascismo,1,"El cierre de la campaña electoral del 4-M, en directo | Hana Jalloul, número dos del PSOE: “Madrid merece un Gobierno sin el veneno de la ultraderecha y el fascismo”",El País,2021-05-02
225,enemigos,1,"Pablo Iglesias y Yolanda Díaz apelan a la movilización masiva ""de la clase trabajadora"" contra ""los enemigos de la democracia""",eldiario.es,2021-05-02
223,ataque,0,Los “escoltas” de Iglesias lideraron el ataque a la Policía en Vallecas,La Razón,2021-05-02
222,enemigo,1,"Iglesias cierra la campaña acusando al PP de Ayuso de ""enemigo arrogante y violento de la democracia""",El Español,2021-05-02
221,atacando,0,"Abascal cierra la campaña atacando a Iglesias, «el machito alfa llorón»",ABC,2021-05-02
220,fascismo,1,Iglesias: “En España se ha normalizado el fascismo”,El País,2021-05-02
224,matones,1,Casado exige a Sánchez que asuma responsabilidades por la detención de los «matones» de Iglesias,ABC,2021-05-02
230,muerte,0,De la libertad a las amenazas de muerte: seis instantes clave de la campaña más polémica,El País,2021-05-03
231,agresividad,0,"El poco carisma de Gabilondo, la agresividad de García y el egocentrismo de Iglesias",La Razón,2021-05-03
232,batalla,1,‘Podcast’ ‘La batalla por Madrid’ | Ep. 11: El último chotis,El País,2021-05-03
233,batalla,0,"Sánchez y Ayuso, batalla final",El País,2021-05-03
234,ataca,0,Tezanos ataca a Ayuso antes del 4-M y llama tabernarios a los votantes del PP,El Confidencial,2021-05-03
241,dispara,0,Récord histórico de participación: se dispara hasta alcanzar el 76%,El Mundo,2021-05-04
240,balance,0,El balance de los politólogos: el triunfo de una campaña sin testosterona,El País,2021-05-04
239,sables,0,Urnas sin sables,El País,2021-05-04
242,aplastante,0,Las 31 preguntas sin respuesta que plantea la aplastante victoria de Ayuso en Madrid,El Español,2021-05-04
237,arremete,0,"Tezanos arremete contra Ayuso: critica su ""escasa entidad intelectual y política""",El Español,2021-05-04
236,catapulta,0,Elecciones en Madrid Mónica García catapulta a Más Madrid a la segunda fuerza y consigue un histórico 'sorpasso' en votos al PSOE,Público,2021-05-04
235,sables,0,Urnas y sables,El País,2021-05-04
238,ataques,0,El 4-M salta a Zaragoza: una querella por incitación al odio y muchos ataques cruzados,El Confidencial,2021-05-04
262,franco,0,La hecatombe en Madrid abre una nueva guerra en el PSOE con Gabilondo y Franco en el disparadero,eldiario.es,2021-05-05
261,guerra,0,La hecatombe en Madrid abre una nueva guerra en el PSOE con Gabilondo y Franco en el disparadero,eldiario.es,2021-05-05
254,golpe,0,"Ley de mercado abierto, golpe a la 'armonización fiscal' y voz del PP en los fondos europeos: la economía tras el 4M",El Español,2021-05-05
253,atacar,0,"Carmen Calvo usa la victoria de Ayuso para atacar a Casado: ""Queda claro que es el dos del PP""",El Español,2021-05-05
252,batacazo,0,"El PSOE asume el batacazo en Madrid: ""Hemos sufrido una derrota que no esperábamos""",El Mundo,2021-05-05
251,batacazo,0,"Arrimadas no dimite, promete “relanzar” Ciudadanos y achaca su batacazo a la polarización",El Español,2021-05-05
250,exploran,0,Más País y sus socios exploran cómo extender el éxito de Más Madrid por toda España,El País,2021-05-05
249,muerto,0,Casado da por muerto a Cs y proclama el regreso del PP: “Volvemos a ser el gran partido de España”,El País,2021-05-05
247,cazanazis,0,El cazanazis casi se canta 'El Necio',Público,2021-05-05
246,batalla,1,Podcast ‘La batalla por Madrid’ | Ep. 12: Así ganó Ayuso,El País,2021-05-05
245,desangra,0,El PSOE se desangra en Madrid y pone en entredicho a Moncloa,El Mundo,2021-05-05
244,facha,1,Dani Mateo ahora es 'facha': el mensaje que le ha valido las críticas de la izquierda,El Español,2021-05-05
243,guerra,0,Vallecas también es territorio Ayuso: la guerra entre Vox y Podemos por el barrio la gana el PP,El Español,2021-05-05
263,disparadero,0,La hecatombe en Madrid abre una nueva guerra en el PSOE con Gabilondo y Franco en el disparadero,eldiario.es,2021-05-05
248,asalto,0,El exjemad Julio Rodríguez será diputado tras tres intentos y un fallido asalto a la alcaldía,El Confidencial,2021-05-05
264,asaltar,0,"Despedida en dos actos de Pablo Iglesias, el hombre que se propuso asaltar los cielos y consiguió ser vicepresidente del Gobierno",eldiario.es,2021-05-05
260,golpe,0,Pedro Sánchez activa una operación estética tras el golpe de las elecciones en Madrid,La Razón,2021-05-06
